Name,Nick Name,Status,Definition,Acronym,Resources,Related Terms,Synonyms,Stewards,Experts,Parent Term Name,IsDefinitionRichText,Term Template Names
Accident_Insurance,Accident Insurance,Approved,insurance for unforeseen bodily injury.,ADD,,,,,,,,
Accident_Only_or_AD_and_D,Accident Only or AD&D,Approved,"policies providing coverage, singly or in combination, for death, dismemberment, disability, or hospital and medical care caused by or necessitated as a result of accident or specified kinds of accidents. Types of coverage include student accident, sports accident, travel accident, blanket accident, specific accident or accidental death and dismemberment (AD&D).",,,,,,,,,
Accident_Only,Accident Only,Approved,"an insurance contract that provides coverage, singly or in combination, for death, dismemberment, disability, or hospital and medical care caused by or necessitated as a result of accident or specified kinds of accident.",,,,,,,,,
Accident,Accident,Approved,an unexpected event or circumstance without deliberate intent.,,,,,,,,,
Accidental_Bodily_Injury,Accidental Bodily Injury,Approved,unexpected injury to a person.,,,,,,,,,
Accidental_Death_and_Dismemberment,Accidental Death and Dismemberment,Approved,an insurance contract that pays a stated benefit in the event of death and/or dismemberment caused by accident or specified kinds of accidents.,,,,,,,,,
Accumulation_Period,Accumulation Period,Approved,period of time insured must incur eligible medical expenses at least equal to the deductible amount in order to establish a benefit period under a major medical expense or comprehensive medical expense policy.,,,,,,,,,
Actual_Cash_Value,Actual Cash Value,Approved,repayment value for indemnification due to loss or damage of property; in most cases it is replacement cost minus depreciation,,,,,,,,,
Actuarial_Report,Actuarial Report,Approved,"(PC Insurance)a document or other presentation, prepared as a formal means of conveying to the state regulatory authority and the Board of Directors, or its equivalent, the actuary's professional conclusions and recommendations, of recording and communicating the methods and procedures, of assuring that the parties addressed are aware of the significance of the actuary's opinion or findings and that documents the analysis underlying the opinion. (In Life and Health) this document would be called an ""Actuarial Memorandum.""",,,,,,,,,
Actuary,Actuary,Approved,"business professional who analyzes probabilities of risk and risk management including calculation of premiums, dividends and other applicable insurance industry standards.",,,,,,,,,
Adjuster,Adjuster,Approved,a person who investigates claims and recommends settlement options based on estimates of damage and insurance policies held.,,,,,,,,,
Admission,Admission,Approved,hospital inpatient care for any medical condition.,,,,,,,,,
Admitted_Assets,Admitted Assets,Approved,insurer assets which can be valued and included on the balance sheet to determine financial viability of the company.,,,,,,,,,
Admitted_Company,Admitted Company,Approved,"an insurance company licensed to do business in a state(s), domiciled in an alternative state or country.",,,,,,,,,
Advance_Premiums,Advance Premiums ,Approved,"occur when a policy has been processed, and the premium has been paid prior to the effective date. These are a liability to the company and not included in written premium or the unearned premium reserve.",,,,,,,,,
Adverse_Selection,Adverse Selection,Approved,the social phenomenon whereby persons with a higher than average probability of loss seek greater insurance coverage than those with less risk.,,,,,,,,,
Advisory_Organization,Advisory Organization,Approved,a group supported by member companies whose function is to gather loss statistics and publish trended loss costs.,,,,,,,,,
Affiliate,Affiliate,Approved,"a person or entity that directly, or indirectly, through one or more other persons or entities, controls, is controlled by or is under common control with the insurer.",,,,,,,,,
Agent,Agent,Approved,"an individual who sells, services, or negotiates insurance policies either on behalf of a company or independently.",,,,,,,,,
Aggregate_Cost_Payments,Aggregate Cost Payments ,Approved,"method of reimbursement of a health plan with a corporate entity that directly provides care, where (1) the health plan is contractually required to pay the total operating costs of the corporate entity, less any income to the entity from other users of services, and (2) there are mutual unlimited guarantees of solvency between the entity and the health plan that put their respective capital and surplus at risk in guaranteeing each other.",,,,,,,,,
Aggregate,Aggregate,Approved,"the maximum dollar amount or total amount of coverage payable for a single loss, or multiple losses, during a policy period, or on a single project.",,,,,,,,,
Aircraft,Aircraft,Approved,"coverage for aircraft (hull) and their contents; aircraft owners' and aircraft manufacturers liability to passengers, airports and other third parties.",,,,,,,,,
ALAE,ALAE,Approved,an estimate of the claims settlement associated with a particular claim or claims.,,,,,,,,,
Alien_Company,Alien Company,Approved,an insurance company formed according to the laws of a foreign country. The company must conform to state regulatory standards to legally sell insurance products in that state.,,,,,,,,,
Allied_Lines,Allied Lines,Approved,"coverages which are generally written with property insurance, e.g., glass, tornado, windstorm and hail; sprinkler and water damage; explosion, riot, and civil commotion; growing crops; flood; rain; and damage from aircraft and vehicle, etc.",,,,,,,,,
All_Risk,All-Risk,Approved,"also known as open peril, this type of policy covers a broad range of losses. The policy covers risks not explicitly excluded in the policy contract.",,,,,,,,,
Alternative_Workers_Compensation,Alternative Workers' Compensation,Approved,"other than standard workers' compensation coverage, employer's liability and excess workers' compensation (e.g., large deductible, managed care).",,,,,,,,,
Ambulatory_Services,Ambulatory Services ,Approved,"health services provided to members who are not confined to a health care institution. Ambulatory services are often referred to as ""outpatient"" services.",,,,,,,,,
Annual_Statement,Annual Statement,Approved,an annual report required to be filed with each state in which an insurer does business. This report provides a snapshot of the financial condition of a company and significant events which occurred throughout the reporting year.,,,,,,,,,
Annuitant,Annuitant,Approved,"the beneficiary of an annuity payment, or person during whose life and annuity is payable.",,,,,,,,,
Annuities_Immediate_Non_variable,Annuities - Immediate Non-variable,Approved,"an annuity contract that provides for the fixed payment of the annuity at the end of the first interval of payment after purchase. The interval may vary, however the annuity payouts must begin within 13 months.",,,,,,,,,
Annuity,Annuity,Approved,"a contract providing income for a specified period of time, or duration of life for a person or persons.",,,,,,,,,
Appraisal,Appraisal,Approved,an estimate of value.,,,,,,,,,
Arbitration,Arbitration,Approved,a binding dispute resolution tactic whereby a conciliator with no interest in the outcome intercedes.,,,,,,,,,
Assessed_Value,Assessed Value,Approved,estimated value for real or personal property established by a taxing entity,,,,,,,,,
Asset_Risk,Asset Risk ,Approved,"in the risk-based capital formula, risk assigned to the company's assets.",,,,,,,,,
Asset,Asset,Approved,"probable future economic benefits obtained or controlled by a particular entity as a result of past transactions or events. An asset has three essential characteristics: It embodies a probable future benefit that involves a capacity, singly or in combination with other assets, to contribute directly or indirectly to future net cash inflows; A particular entity can obtain the benefit and control others' access to it; and The transaction or other event-giving rise to the entity's right to or control of the benefit has already occurred.",,,,,,,,,
Assigned_Risk,Assigned Risk,Approved,A governmental pool established to write business declined by carriers in the standard insurance market.,,,,,,,,,
Assisted_Living_Care,Assisted Living Care,Approved,a policy or rider that provides coverage only while a policyholder is confined to an assisted living facility and meets the policy requirements for coverage.,,,,,,,,,
Assumed_Reinsurance,Assumed Reinsurance ,Approved,the assumption of risk from another insurance entity within a reinsurance agreement or treaty.,,,,,,,,,
Authorized_Company,Authorized Company ,Approved,an insurer licensed or admitted to do business in a particular state.,,,,,,,,,
Authorized_Control_Level_Risk_Based_Capital,Authorized Control Level Risk Based Capital,Approved,theoretical amount of capital plus surplus an insurance company should maintain.,,,,,,,,,
Authorized_Reinsurance,Authorized Reinsurance ,Approved,reinsurance placed with a reinsurer who is licensed or otherwise allowed to conduct reinsurance within a state.,,,,,,,,,
Auto_Liability,Auto Liability,Approved,"coverage that protects against financial loss because of legal liability for motor vehicle related injuries (bodily injury and medical payments) or damage to the property of others caused by accidents arising out of ownership, maintenance or use of a motor vehicle (including recreational vehicles such as motor homes). Commercial is defined as all motor vehicle policies that include vehicles that are used primarily in connection with business, commercial establishments, activity, employment, or activities carried on for gain or profit. No Fault is defined by the state concerned.",,,,,,,,,
Auto_Physical_Damage,Auto Physical Damage,Approved,"motor vehicle insurance coverage (including collision, vandalism, fire and theft) that insures against material damage to the insured's vehicle. Commercial is defined as all motor vehicle policies that include vehicles that are used in connection with business, commercial establishments, activity, employment, or activities carried on for gain or profit.",,,,,,,,,
Automobile_Liability_Insurance,Automobile Liability Insurance,Approved,coverage for bodily injury and property damage incurred through ownership or operation of a vehicle.,,,,,,,,,
Balance_Sheet,Balance Sheet ,Approved,accounting statement showing the financial condition of a company at a particular date.,,,,,,,,,
BCEGS_Building_Code_Effectiveness_Grading_Schedule,BCEGS - Building Code Effectiveness Grading Schedule,Approved,classification system for assessment of building codes per geographic region with special emphasis on mitigation of losses from natural disasters.,,,,,,,,,
Beneficiary,Beneficiary,Approved,"an individual who may become eligible to receive payment due to will, life insurance policy, retirement plan, annuity, trust, or other contract.",,,,,,,,,
Benefits_Medical_and_Hospital_Expenses,Benefits (Medical and Hospital Expenses) ,Approved,total expenditures for health care services paid to or on behalf of a member.,,,,,,,,,
Blanket_coverage,Blanket coverage,Approved,"coverage for property and liability that extends to more than one location, class of property or employee.",,,,,,,,,
Boatowners_Personal_Watercraft,Boatowners/Personal Watercraft,Approved,"covers damage to pleasure boats, motors, trailers, boating equipment and personal watercraft as well as bodily injury and property damage liability to others.",,,,,,,,,
Bodily_Injury,Bodily Injury,Approved,physical injury including sickness or disease to a person.,,,,,,,,,
Boiler_and_Machinery_or_Equipment_Breakdown_and_Machinery,Boiler and Machinery or Equipment Breakdown and Machinery,Approved,"coverage for the failure of boilers, machinery and other electrical equipment. Benefits include (i) property of the insured, which has been directly damaged by the accident; (ii) costs of temporary repairs and expediting expenses; and (iii) liability for damage to the property of others. Coverage also includes inspection of the equipment.",,,,,,,,,
Bonds,Bonds,Approved,"a form of debt security whereby the debt holder has a creditor stake in the company. Obligations issued by business units, governmental units and certain nonprofit units having a fixed schedule for one or more future payments of money; includes commercial paper, negotiable certificates of deposit, repurchase agreements and equipment trust certificates.",,,,,,,,,
Book_Value,Book Value ,Approved,"original cost, including capitalized acquisition costs and accumulated depreciation, unamortized premium and discount, deferred origination and commitment fees, direct write-downs, and increase/decrease by adjustment.",,,,,,,,,
Broker,Broker,Approved,an individual who receives commissions from the sale and service of insurance policies. These individuals work on behalf of the customer and are not restricted to selling policies for a specific company but commissions are paid by the company with which the sale was made.,,,,,,,,,
Builders_Risk_Policies,Builders' Risk Policies,Approved,"typically written on a reporting or completed value form, this coverage insures against loss to buildings in the course of construction. The coverage also includes machinery and equipment used in the course of construction and to materials incidental to construction.",,,,,,,,,
Burglary_and_Theft,Burglary and Theft,Approved,"coverage for property taken or destroyed by breaking and entering the insured's premises, burglary or theft, forgery or counterfeiting, fraud, kidnap and ransom, and off-premises exposure.",,,,,,,,,
Business_Auto,Business Auto,Approved,"coverage for motor vehicles, other than those in the garage business, engaged in commerce. Business auto filings include singularly or in any combination coverage such as the following: Auto Liability, PIP, MP, Uninsured Motorist and/or Underinsured Motorists (UM/UIM); Specified Causes of Loss, Comprehensive, and Collision.",,,,,,,,,
Business_Interruption,Business Interruption,Approved,loss of income as a result of property damage to a business facility.,,,,,,,,,
Business_owners_Policy,Business owners Policy,Approved,"business insurance typically for property, liability and business interruption coverage.",,,,,,,,,
Calendar_Year_Deductible,Calendar Year Deductible,Approved,"in health insurance, the amount that must be paid by the insured during a calendar year before the insurer becomes responsible for further loss costs.",,,,,,,,,
Capital_and_Surplus,Capital and Surplus ,Approved,a company's assets minus its liabilities.,,,,,,,,,
Capital_and_Surplus_Requirement,Capital and Surplus Requirement ,Approved,"statutory requirement ordering companies to maintain their capital and surplus at an amount equal to or in excess of a specified amount to help assure the solvency of the company by providing a financial cushion against expected loss or misjudgments and generally measured as a company's admitted assets minus its liabilities, determined on a statutory accounting basis.",,,,,,,,,
Capital_Gains_Loss,Capital Gains (Loss) ,Approved,"excess (deficiency) of the sales price of an asset over its book value. Calculated on the basis of original cost adjusted, as appropriate, for accrual of discount or amortization of premium and for depreciation.",,,,,,,,,
Capitation_Arrangement,Capitation Arrangement ,Approved,"a compensation plan used in connection with some managed care contracts where a physician or other medical provider is paid a flat amount, usually on a monthly basis, for each subscriber who has elected to use that physician or medical provider. Capitated payments are sometimes expressed in terms of a ""per member/per month"" payment. The capitated provider is generally responsible, under the conditions of the contract, for delivering or arranging for the delivery of all contracted health services required by the covered person.",,,,,,,,,
Captive_Agent,Captive Agent,Approved,an individual who sells or services insurance contracts for a specific insurer or fleet of insurers.,,,,,,,,,
Captive_Insurer,Captive Insurer,Approved,an insurance company established by a parent firm for the purpose of insuring the parent's exposures.,,,,,,,,,
Carrying_Value_Amount,Carrying Value (Amount) ,Approved,the SAP book value plus accrued interest and reduced by any valuation allowance and any nonadmitted adjustment applied to the individual investment.,,,,,,,,,
Cash_Equivalent,Cash Equivalent ,Approved,"short-term, highly liquid investments that are both (a) readily convertible to known amounts of cash, and (b) so near their maturity that they present insignificant risk of changes in value because of changes in interest rates. Investments with original maturities of three months or less qualify under this definition.",,,,,,,,,
Cash,Cash,Approved,a medium of exchange.,,,,,,,,,
Casualty_Insurance,Casualty Insurance,Approved,"a form of liability insurance providing coverage for negligent acts and omissions such as workers compensation, errors and omissions, fidelity, crime, glass, boiler, and various malpractice coverages.",,,,,,,,,
Catastrophe_Bonds,Catastrophe Bonds,Approved,"Bonds issued by an insurance company with funding tied to the company's losses from disasters, or acts of God. A loss exceeding a certain size triggers a reduction in the bond value or a change in the bond structure as loss payments are paid out of bond funds.",,,,,,,,,
Catastrophe_Loss,Catastrophe Loss,Approved,a large magnitude loss with little ability to forecast.,,,,,,,,,
Ceded_Premium,Ceded Premium ,Approved,amount of premium (fees) used to purchase reinsurance.,,,,,,,,,
Ceding_Company,Ceding Company,Approved,an insurance company that transfers risk by purchasing reinsurance.,,,,,,,,,
Centers_for_Medicare_and_Medicaid_Services_CMS,Centers for Medicare and Medicaid Services (CMS) ,Approved,U.S. governmental agency responsible for the licensing of federally qualified HMOs. This was formerly the Health Care Financing Administration.,,,,,,,,,
Change_in_Valuation_Basis,Change in Valuation Basis ,Approved,"a change in the interest rate, mortality assumption or reserving method or other factors affecting the reserve computation of policies in force.",,,,,,,,,
Chartered_Life_Underwriter_CLU,Chartered Life Underwriter (CLU),Approved,"a professional designation awarded by the American College to persons in the life insurance field who pass a series of exams in insurance, investment, taxation, employee benefit plans, estate planning, accounting, management, and economics.",,,,,,,,,
Chartered_Property_Casualty_Underwriter_CPCU,Chartered Property Casualty Underwriter (CPCU),Approved,"a professional designation awarded by the American Institute of Property and Casualty Underwriters to persons in the property and liability insurance field who pass a series of exams in insurance, risk management, economics, finance, management, accounting, and law. Designates must also have at least three years experience in the insurance business or related field.",,,,,,,,,
Claim,Claim,Approved,a request made by the insured for insurer remittance of payment due to loss incurred and covered under the policy agreement.,,,,,,,,,
Claims_Adjustment_Expenses,Claims Adjustment Expenses ,Approved,"costs expected to be incurred in connection with the adjustment and recording of accident and health, auto medical and workers' compensation claims.",,,,,,,,,
Claims_made_Form,Claims-made Form,Approved,A type of liability insurance form that only pays if the both event that causes (triggers)the claim and the actual claim are submitted to the insurance company during the policy term,,,,,,,,,
Class_Rating,Class Rating,Approved,a method of determining rates for all applicants within a given set of characteristics such as personal demographic and geographic location.,,,,,,,,,
Coinsurance,Coinsurance,Approved,"A clause contained in most property insurance policies to encourage policy holders to carry a reasonable amount of insurance. If the insured fails to maintain the amount specified in the clause (Usually at least 80%), the insured shares a higher proportion of the loss. In medical insurance a percentage of each claim that the insured will bear.",,,,,,,,,
Collar,Collar,Approved,"an agreement to receive payments as the buyer of an Option, Cap or Floor and to make payments as the seller of a different Option, Cap or Floor.",,,,,,,,,
Collateral_Loans,Collateral Loans ,Approved,unconditional obligations for the payment of money secured by the pledge of an investment.,,,,,,,,,
Collateralized_Bond_Obligations_CBOs,Collateralized Bond Obligations (CBOs) ,Approved,"an investment-grade bond backed by a pool of low-grade debt securities, such as junk bonds, separated into tranches based on various levels of credit risk.",,,,,,,,,
Collateralized_Mortgage_Obligations_CMOs,Collateralized Mortgage Obligations (CMOs) ,Approved,a type of mortgage-backed security (MBS) with separate pools of pass-through security mortgages that contain varying classes of holders and maturities (tranches) with the advantage of predictable cash flow patterns.,,,,,,,,,
Combinations,Combinations,Approved,a special form of package policy composed of personal automobile and homeowners insurance.,,,,,,,,,
Combined_Ratio,Combined Ratio,Approved,"an indication of the profitability of an insurance company, calculated by adding the loss and expense ratios.",,,,,,,,,
Commencement_Date,Commencement Date,Approved,"date when the organization first became obligated for any insurance risk via the issuance of policies and/or entering into a reinsurance agreement. Same as ""effective date"" of coverage.",,,,,,,,,
Commercial_Auto,Commercial Auto,Approved,"coverage for motor vehicles owned by a business engaged in commerce that protects the insured against financial loss because of legal liability for motor vehicle related injuries, or damage to the property of others caused by accidents arising out of the ownership, maintenance, use, or care-custody and control of a motor vehicle. This includes Commercial Auto Combinations of Business Auto, Garage, Truckers and/or Other Commercial Auto.",,,,,,,,,
Commercial_Earthquake,Commercial Earthquake,Approved,earthquake property coverage for commercial ventures.,,,,,,,,,
Commercial_Farm_and_Ranch,Commercial Farm and Ranch,Approved,"a commercial package policy for farming and ranching risks that includes both property and liability coverage. Coverage includes barns, stables, other farm structures and farm inland marine, such as mobile equipment and livestock.",,,,,,,,,
Commercial_Flood,Commercial Flood,Approved,separate flood insurance policy sold to commercial ventures.,,,,,,,,,
Commercial_General_Liability,Commercial General Liability,Approved,flexible and broad commercial liability coverage with two major sub-lines: premises/operations sub-line and products/completed operations sub-line.,,,,,,,,,
Commercial_Mortgage_Backed_Securities,Commercial Mortgage-Backed Securities ,Approved,a type of mortgage-backed security that is secured by the loan on a commercial property.,,,,,,,,,
Commercial_Multiple_Peril,Commercial Multiple Peril ,Approved,"policy that packages two or more insurance coverages protecting an enterprise from various property and liability risk exposures. Frequently includes fire, allied lines, various other coverages (e.g., difference in conditions) and liability coverage. Such coverages would be included in other annual statement lines, if written individually. Include under this type of insurance multi-peril policies (other than farmowners, homeowners and automobile policies) that include coverage for liability other than auto.",,,,,,,,,
Commercial_Package_Policy,Commercial Package Policy,Approved,provides a broad package of property and liability coverages for commercial ventures other than those provided insurance through a business owners policy.,,,,,,,,,
Commercial_Property,Commercial Property,Approved,property insurance coverage sold to commercial ventures.,,,,,,,,,
Commission,Commission,Approved,a percentage of premium paid to agents by insurance companies for the sale of policies.,,,,,,,,,
Community_Rating,Community Rating ,Approved,a rating system where standard rating is established and usually adjusted within specific guidelines for each group on the basis of anticipated utilization by the group's employees.,,,,,,,,,
Company_Code,Company Code ,Approved,"a five-digit identifying number assigned by NAIC, assigned to all insurance companies filing financial data with NAIC.",,,,,,,,,
Completed_Operations_Liability,Completed Operations Liability,Approved,"policies covering the liability of contractors, plumbers, electricians, repair shops, and similar firms to persons who have incurred bodily injury or property damage from defective work or operations completed or abandoned by or for the insured, away from the insured's premises.",,,,,,,,,
Comprehensive_Hospital_and_Medical,Comprehensive (Hospital and Medical) ,Approved,"line of business providing for medical coverages; includes hospital, surgical, major medical coverages; does not include Medicare Supplement, administrative services (ASC) contracts, administrative services only (ASO) contracts, federal employees health benefit plans (FEHBP), medical only programs, Medicare and Medicaid programs, vision only and dental only business.",,,,,,,,,
Comprehensive_General_Liability_CGL,Comprehensive General Liability (CGL),Approved,coverage of all business liabilities unless specifically excluded in the policy contract.,,,,,,,,,
