Name,Nick Name,Status,Definition,Acronym,Resources,Related Terms,Synonyms,Stewards,Experts,Parent Term Name,IsDefinitionRichText,Term Template Names
Comprehensive_Personal_Liability,Comprehensive Personal Liability,Approved,comprehensive liability coverage for exposures arising out of the residence premises and activities of individuals and family members. (Non-business liability exposure protection for individuals.),,,,,,,,,
Comprehensive_Major_Medical,Comprehensive/Major Medical,Approved,"policies that provide fully insured indemnity, HMO, PPO, or Fee for Service coverage for hospital, medical, and surgical expenses. Coverage excludes Short-Term Medical Insurance, the Federal Employees Health Benefit Program and non-comprehensive coverage such as basic hospital only, medical only, hospital confinement indemnity, surgical, outpatient indemnity, specified disease, intensive care, and organ and tissue transplant coverage.",,,,,,,,,
Concurrent_Causation,Concurrent Causation,Approved,property loss incurred from two or more perils in which only one loss is covered but both are paid by the insurer due to simultaneous incident.,,,,,,,,,
Conditions,Conditions,Approved,requirements specified in the insurance contract that must be upheld by the insured to qualify for indemnification.,,,,,,,,,
Condos,Condos,Approved,homeowners insurance sold to condominium owners occupying the described property.,,,,,,,,,
Construction_and_Alteration_Liability,Construction and Alteration Liability,Approved,"covering the liability of an insured to persons who have incurred bodily injury or property damage from alterations involving demolition, new construction or change in size of a structure on the insured's premises.",,,,,,,,,
Contingency_Reserves,Contingency Reserves ,Approved,"required by some jurisdictions as a hedge against adverse experience from operations, particularly adverse claim experience.",,,,,,,,,
Contingent_Liability,Contingent Liability,Approved,"the liability of an insured to persons who have incurred bodily injury or property damage from work done by an independent contractor hired by the insured to perform work that was illegal, inherently dangerous, or directly supervised by the insured",,,,,,,,,
Continuation_of_Care_Requirement,Continuation of Care Requirement ,Approved,statutory or contractual provision requiring providers to deliver care to an enrollee for some period following the date of a Health Plan Company's insolvency.,,,,,,,,,
Continuing_Care_Retirement_Communities,Continuing Care Retirement Communities,Approved,senior housing arrangements that in addition to housing include some provision for skilled nursing care.,,,,,,,,,
Contract_Reserves,Contract Reserves,Approved,"reserves set up when, due to the gross premium structure, the future benefits exceed the future net premium. Contract reserves are in addition to claim and premium reserves.",,,,,,,,,
Contractual_Liability,Contractual Liability,Approved,liability coverage of an insured who has assumed the legal liability of another party by written or oral contract. Includes a contractual liability policy providing coverage for all obligations and liabilities incurred by a service contract provider under the terms of service contracts issued by the provider.,,,,,,,,,
Convertible_Term_Insurance_Policy,Convertible Term Insurance Policy,Approved,an insurance policy that can be converted into permanent insurance without a medical assessment. The insurer is required to renew the policy regardless of the health of the insured subject to policy conditions.,,,,,,,,,
Coordination_of_Benefits_COB,Coordination of Benefits (COB) ,Approved,provision to eliminate over insurance and establish a prompt and orderly claims payment system when a person is covered by more than one group insurance and/or group service plan.,,,,,,,,,
Copay,Copay,Approved,a cost sharing mechanism in group insurance plans where the insured pays a specified dollar amount of incurred medical expenses and the insurer pays the remainder.,,,,,,,,,
Corrective_Order,Corrective Order,Approved,commissioner's directive of action to be completed by an insurer.,,,,,,,,,
Covered_Lives,Covered Lives,Approved,"The total number of lives insured, including dependents, under individual policies and group certificates.",,,,,,,,,
Credit_Assumption_Agreement,Credit – Assumption Agreement,Approved,an insurance certificate issued on an existing insurance contract indicating that another insurer has assumed all of the risk under the contract from the ceding insurance company.,,,,,,,,,
Credit_Credit_Default,Credit - Credit Default,Approved,"coverage purchased by manufacturers, merchants, educational institutions, or other providers of goods and services extending credit, for indemnification of losses or damages resulting from the nonpayment of debts owed to them for goods or services provided in the normal course of their business.",,,,,,,,,
Credit_Involuntary_Unemployment,Credit – Involuntary Unemployment,Approved,makes loan/credit transaction payments to the creditor when the debtor becomes involuntarily unemployed.,,,,,,,,,
Credit_Accident_and_Health_group_and_individual,Credit Accident and Health (group and individual),Approved,"coverage provided to or offered to borrowers in connection with a consumer credit transaction where the proceeds are used to repay a debt or an installment loan in the event the consumer is disabled as the result of an accident, including business not exceeding 120 months duration.",,,,,,,,,
Credit_Disability,Credit Disability,Approved,makes monthly loan/credit transaction payments to the creditor upon the disablement of an insured debtor.,,,,,,,,,
Credit_Health_Insurance,Credit Health Insurance,Approved,policy assigning creditor as beneficiary for insurance on a debtor thereby remitting balance of payment to creditor should the debtor become disabled.,,,,,,,,,
Credit_Involuntary_Unemployment,Credit Involuntary Unemployment,Approved,"credit insurance that provides a monthly or lump sum benefit during an unpaid leave of absence from employment resulting from specified causes, such as layoff, business closure, strike, illness of a close relative and adoption or birth of a child. This insurance is sometimes referred to as Credit Family Leave.",,,,,,,,,
Credit_Life_Insurance,Credit Life Insurance,Approved,policy assigning creditor as beneficiary for insurance on a debtor thereby remitting balance of payment to creditor upon death of debtor.,,,,,,,,,
Credit_Personal_Property_Insurance,Credit Personal Property Insurance,Approved,"insurance written in connection with a credit transaction where the collateral is not a motor vehicle, mobile home or real estate and that covers perils to the goods purchased through a credit transaction or used as collateral for a credit transaction and that concerns a creditor's interest in the purchased goods or pledged collateral, either in whole or in part; or covers perils to goods purchased in connection with an open-end transaction.",,,,,,,,,
Credit_Placed_Insurance,Credit Placed Insurance,Approved,"insurance that is purchased unilaterally by the creditor, who is the named insured, subsequent to the date of the credit transaction, providing coverage against loss, expense or damage to property as a result of fire, theft, collision or other risks of loss that would either impair a creditor's interest or adversely affect the value of collateral. ""Creditor Placed Home"" means ""Creditor Placed Insurance"" on homes, mobile homes and other real estate. ""Creditor Placed Auto"" means insurance on automobiles, boats or other vehicles.",,,,,,,,,
Credit_Risk,Credit Risk ,Approved,part of the risk-based capital formula that addresses the collectability of a company's receivables and the risk of losing a provider or intermediary that has received advance capitation payments.,,,,,,,,,
Credit,Credit,Approved,"individual or group policies that provide benefits to a debtor for full or partial repayment of debt associated with a specific loan or other credit transaction upon disability or involuntary unemployment of debtor, except in connection with first mortgage loans.",,,,,,,,,
Creditor_Placed_Auto,Creditor-Placed Auto,Approved,"single interest or dual interest credit insurance that is purchased unilaterally by the creditor, who is the named insured, subsequent to the date of the credit transaction, providing coverage against loss to property that would either impair a creditor's interest or adversely affect the value of collateral on automobiles, boats, or other vehicles.",,,,,,,,,
Creditor_Placed_Home,Creditor-Placed Home,Approved,"single interest or dual interest credit insurance purchased unilaterally by the creditor, who is the named insured, subsequent to the date of the credit transaction, providing coverage against loss to property that would either impair a creditor's interest or adversely affect the value of collateral on homes, mobile homes, and other real estate.",,,,,,,,,
Crop,Crop,Approved,"coverage protecting the insured against loss or damage to crops from a variety of perils, including but not limited to fire, lightening, loss of revenue, tornado, windstorm, hail, flood, rain, or damage by insects.",,,,,,,,,
Crop_Hail_Insurance,Crop-Hail Insurance,Approved,"coverage for crop damage due to hail, fire or lightning.",,,,,,,,,
Date_of_Issue,Date of Issue ,Approved,date when an insurance company issues a policy.,,,,,,,,,
Declarations,Declarations,Approved,"policy statements regarding the applicant and property covered such as demographic and occupational information, property specifications and expected mileage per year .",,,,,,,,,
Deductible,Deductible,Approved,Portion of the insured loss (in dollars) paid by the policy holder,,,,,,,,,
Deferred_Annuity,Deferred Annuity,Approved,"annuity payment to be made as a single payment or a series of installments to begin at some future date, such as in a specified number of years or at a specified age.",,,,,,,,,
Demutualization,Demutualization,Approved,conversion of a mutual insurance company to a capital stock company.,,,,,,,,,
Dental_Insurance,Dental Insurance,Approved,"policies providing only dental treatment benefits such as routine dental examinations, preventive dental work, and dental procedures needed to treat tooth decay and diseases of the teeth and jaw.",,,,,,,,,
Dental_Only,Dental Only ,Approved,"line of business providing dental only coverage; coverage can be on a stand-alone basis or as a rider to a medical policy. If the coverage is as a rider, deductibles or out-of-pocket limits must be set separately from the medical coverage. Does not include self-insured business as well as FEHBP or Medicare and Medicaid programs.",,,,,,,,,
Derivative,Derivative,Approved,"securities priced according to the value of other financial instruments such as commodity prices, interest rates, stock market prices, foreign or exchange rates.",,,,,,,,,
Difference_In_Conditions_DIC_Insurance,Difference In Conditions (DIC) Insurance,Approved,special form of open-peril coverage written in conjunction with basic fire coverage and designed to provide protection against losses not reimbursed under the standard fire forms. Examples are flood and earthquake coverage.,,,,,,,,,
Direct_Incurred_Loss,Direct Incurred Loss,Approved,loss whereby the proximate cause is equivalent to the insured peril.,,,,,,,,,
Direct_Loss,Direct Loss,Approved,Damage to covered real or personal property caused by a covered peril.,,,,,,,,,
Direct_Writer,Direct Writer,Approved,an insurance company that sells policies to the insured through salaried representatives or exclusive agents only; reinsurance companies that deal directly with ceding companies instead of using brokers.,,,,,,,,,
Direct_Written_Premium,Direct Written Premium ,Approved,total premiums received by an insurance company without any adjustments for the ceding of any portion of these premiums to the Reinsurer.,,,,,,,,,
Directors_and_Officers_Liability,Directors and Officers Liability,Approved,liability coverage protecting directors or officers of a corporation from liability arising out of the performance of their professional duties on behalf of the corporation.,,,,,,,,,
Disability_Income_Long_Term,Disability Income - Long-Term,Approved,policies that provide a weekly or monthly income benefit for more than five years for individual coverage and more than one year for group coverage for full or partial disability arising from accident and/or sickness.,,,,,,,,,
Disability_Income_Short_Term,Disability Income - Short-Term,Approved,policies that provide a weekly or monthly income benefit for up to five years for individual coverage and up to one year for group coverage for full or partial disability arising from accident and/or sickness.,,,,,,,,,
Disability_Income,Disability Income,Approved,a policy designed to compensate insured individuals for a portion of the income they lose because of a disabling injury or illness.,,,,,,,,,
Dividend,Dividend,Approved,a refund of a portion of the premium paid by the insured from insurer surplus.,,,,,,,,,
Domestic_Insurer,Domestic Insurer ,Approved,an insurance company that is domiciled and licensed in the state in which it sells insurance.,,,,,,,,,
Dual_Interest,Dual Interest,Approved,"insurance that protects the creditor's and the debtor's interest in the collateral securing the debtor's credit transaction. ""Dual Interest"" includes insurance commonly referred to as ""Limited Dual Interest.""",,,,,,,,,
Dwelling_Property_Personal_Liability,Dwelling Property/Personal Liability,Approved,"a special form of package policy composed of dwelling fire and/or allied lines, and personal liability insurance.",,,,,,,,,
Early_warning_system,Early warning system,Approved,a system designed by insurance industry regulators of identifying practices and risk-related trends that contribute to systemic risk by measuring insurer' financial stability.,,,,,,,,,
Earned_Premium,Earned Premium,Approved,"portion of insured's prepaid premium allocated to the insurance company's loss experience, expenses, and profit year- to -date.",,,,,,,,,
Earthquake,Earthquake,Approved,"property coverages for losses resulting from a sudden trembling or shaking of the earth, including that caused by volcanic eruption. Excluded are losses resulting from fire, explosion, flood or tidal wave following the covered event.",,,,,,,,,
EBNR_Earned_but_not_reported,EBNR - Earned but not reported,Approved,premium amount insurer reasonably expects to receive for which contracts are not yet final and exact amounts are not definite.,,,,,,,,,
EDP_Policies,EDP Policies,Approved,coverage to protect against losses arising out of damage to or destruction of electronic data processing equipment and its software.,,,,,,,,,
Effective_Date,Effective Date ,Approved,date at which an insurance policy goes into force.,,,,,,,,,
Elevators_and_Escalators_Liability,Elevators and Escalators Liability,Approved,"liability coverage for bodily injury or property damage arising from the use of elevators or escalators operated, maintained or controlled by the insured.",,,,,,,,,
Employee_Benefit_Liability,Employee Benefit Liability,Approved,"liability protection for an employer for claims arising from provisions in an employee benefit insurance plan provided for the economic and social welfare of employees. Examples of items covered are pension plans, group life insurance, group health insurance, group disability income insurance, and accidental death and dismemberment.",,,,,,,,,
Employee_Retirement_Income_Security_Act_of_1974_ERISA,Employee Retirement Income Security Act of 1974 (ERISA),Approved,"a federal statute governing standards for private pension plans, including vesting requirements, funding mechanisms, and plan design.",,,,,,,,,
Employers_Liability,Employers Liability,Approved,"employers' liability coverage for the legal liability of employers arising out of injuries to employees. This code should be used when coverage is issued as an endorsement, or as part of a statutory workers' compensation policy.",,,,,,,,,
Employment_Practices_Liability_Coverage,Employment Practices Liability Coverage,Approved,"liability insurance for employers providing coverage for wrongful termination, discrimination, or sexual harassment of the insured's current or former employees.",,,,,,,,,
Encumbrance,Encumbrance,Approved,outstanding mortgages or other debt related to real estate and any unpaid accrued acquisition or construction costs.,,,,,,,,,
Endorsement,Endorsement,Approved,an amendment or rider to a policy adjusting the coverages and taking precedence over the general contract.,,,,,,,,,
Enrollment,Enrollment,Approved,"The total number of plans, not the total number of covered lives, providing coverage to the enrollee and their dependents.",,,,,,,,,
Environmental_Impairment_Liability_EIL,Environmental Impairment Liability (EIL) ,Approved,coverage for negligence or omission resulting in pollution or environmental contamination.,,,,,,,,,
Environmental_Pollution_Liability,Environmental Pollution Liability,Approved,"liability coverage of an insured to persons who have incurred bodily injury or property damage from acids, fumes, smoke, toxic chemicals, waste materials or other pollutants.",,,,,,,,,
Equity_Indexed_Annuity,Equity Indexed Annuity,Approved,"a fixed annuity that earns interest or provides benefits that are linked to an external reference or equity index, subject to a minimum guarantee.",,,,,,,,,
Errors_and_Omissions_Liability_|_Professional_Liability_other_than_Medical,Errors and Omissions Liability | Professional Liability other than Medical,Approved,"liability coverage of a professional or quasi professional insured to persons who have incurred bodily injury or property damage, or who have sustained any loss from omissions arising from the performance of services for others, errors in judgment, breaches of duty, or negligent or wrongful acts in business conduct.",,,,,,,,,
Event_Cancellation,Event Cancellation,Approved,coverage for financial loss because of the cancellation or postponement of a specific event due to weather or other unexpected cause beyond the control of the insured.,,,,,,,,,
Excess_and_Umbrella_Liability,Excess and Umbrella Liability,Approved,liability coverage of an insured above a specific amount set forth in a basic policy issued by the primary insurer; or a self insurer for losses over a stated amount; or an insured or self insurer for known or unknown gaps in basic coverages or self insured retentions.,,,,,,,,,
Excess_of_Loss_Reinsurance,Excess of Loss Reinsurance,Approved,loss sharing mechanism where an insurer pays all claims up to a specified amount and a reinsurance company pays any claims in excess of stated amount.,,,,,,,,,
Excess_Workers_Compensation,Excess Workers' Compensation,Approved,either specific and/or aggregate excess workers' compensation insurance written above an attachment point or self-insured retention.,,,,,,,,,
Expense_Ratio,Expense Ratio,Approved,percentage of premium income used to attain and service policies. Derived by subtracting related expenses from incurred losses and dividing by written premiums.,,,,,,,,,
Experience_Rating,Experience Rating ,Approved,"rating system where each group is rated entirely on the basis of its own expected claims in the coming period, with retrospective adjustments for prior periods. This method is prohibited under the conditions for federal qualification.",,,,,,,,,
Exposure,Exposure,Approved,risk of possible loss.,,,,,,,,,
Extra_Expense_Insurance,Extra Expense Insurance,Approved,a type of property insurance for extraordinary expenses related to business interruption such as a back-up generator in case of power failure.,,,,,,,,,
Face_Amount,Face Amount,Approved,the value of a policy to be provided upon maturity date or death.,,,,,,,,,
Facultative_Reinsurance,Facultative Reinsurance,Approved,reinsurance for a specific policy for which terms can be negotiated by the original insurer and reinsurer.,,,,,,,,,
FAIR_Plan_Fair_Access_to_Insurance_Requirements,FAIR Plan - Fair Access to Insurance Requirements,Approved,state pools designed to provide insurance to property owners who are unable to obtain property insurance through conventional means.,,,,,,,,,
Fair_Value,Fair Value ,Approved,"the amount at which an asset (or liability) could be bought (or incurred) or sold (or settled) in a current transaction between willing parties, that is, other than in a forced or liquidation sale. Quoted market prices in active markets are the best evidence of fair value and shall be used as the basis for the measurement, if available. If a quoted market price is available, the fair value is the product of the number of trading units times market price.",,,,,,,,,
Farmowners_Insurance,Farmowners Insurance,Approved,"farmowners insurance sold for personal, family or household purposes. This package policy is similar to a homeowners policy, in that it has been developed for farms and ranches and includes both property and liability coverage for personal and business losses. Coverage includes farm dwellings and their contents, barns, stables, other farm structures and farm inland marine, such as mobile equipment and livestock.",,,,,,,,,
Federal_Flood_Insurance,Federal Flood Insurance,Approved,"coverage for qualifying residents and businesses in flood prone regions through the National Flood Insurance Act, a federally subsidized flood insurance program enacted in 1968.",,,,,,,,,
Federally_Reinsured_Crop,Federally Reinsured Crop,Approved,"crop insurance coverage that is either wholly or in part reinsured by the Federal Crop Insurance Corporation (FCIC) under the Standard Reinsurance Agreement (SRA). This includes the following products: Multiple Peril Crop Insurance (MPCI); Catastrophic Insurance, Crop Revenue Coverage (CRC); Income Protection and Revenue Assurance.",,,,,,,,,
Fees_Payable,Fees Payable,Approved,fees incurred but not yet paid.,,,,,,,,,
FEMA_Federal_Emergency_Management_Agency,FEMA - Federal Emergency Management Agency,Approved,"an independent agency, tasked with responding to, planning for, mitigating and recovery efforts of natural disasters.",,,,,,,,,
Fidelity,Fidelity,Approved,"a bond or policy covering an employer's loss resulting from an employee's dishonest act (e.g., loss of cash, securities, valuables, etc.).",,,,,,,,,
Financial_Guaranty,Financial Guaranty,Approved,"a surety bond, insurance policy, or an indemnity contract (when issued by an insurer), or similar guaranty types under which loss is payable upon proof of occurrence of financial loss to an insured claimant, obligee or indemnitee as a result of failure to perform a financial obligation or any other permissible product that is defined as or determined to be financial guaranty insurance.",,,,,,,,,
Financial_Reporting,Financial Reporting ,Approved,insurance companies are required to maintain records and file annual and quarterly financial statements with regulators in accordance with statutory accounting principles (SAP). Statutory rules also govern how insurers should establish reserves for invested assets and claims and the conditions under which they can claim credit for reinsurance ceded.,,,,,,,,,
Financial_Responsibility_Law,Financial Responsibility Law,Approved,a statute requiring motorists to show capacity to pay for automobile-related losses.,,,,,,,,,
Financial_Statement,Financial Statement ,Approved,"balance sheet and profit and loss statement of an insurance company. This statement is used by the NAIC, and by State Insurance Commissioners to regulate an insurance company according to reserve requirements, assets, and other liabilities.",,,,,,,,,
Fire_Legal_Liability,Fire Legal Liability,Approved,"coverage for property loss liability as the result of separate negligent acts and/or omissions of the insured that allows a spreading fire to cause bodily injury or property damage of others. An example is a tenant who, while occupying another party's property, through negligence causes fire damage to the property.",,,,,,,,,
Fire,Fire,Approved,"coverage protecting the insured against the loss to real or personal property from damage caused by the peril of fire or lightning, including business interruption, loss of rents, etc.",,,,,,,,,
Flood,Flood,Approved,"coverage protecting the insured against loss or damage to real or personal property from flood. (Note: If coverage for flood is offered as an additional peril on a property insurance policy, file it under the applicable property insurance filing code.)",,,,,,,,,
Foreign_Insurer,Foreign Insurer,Approved,an insurance company selling policies in a state other than the state in which they are incorporated or domiciled.,,,,,,,,,
Foreign_Investment,Foreign Investment,Approved,"an investment in a foreign jurisdiction, or an investment in a person, real estate or asset domiciled in a foreign jurisdiction. An investment shall not be deemed to be foreign if the issuing person, qualified primary credits source or qualified guarantor is a domestic jurisdiction or a person domiciled in a domestic jurisdiction, unless: a) The issuing person is a shell business entity; and b) The investment is not assumed, accepted, guaranteed or insured or otherwise backed by a domestic jurisdiction or a person, that is not a shell business entity, domiciled in a domestic jurisdiction.",,,,,,,,,
Foreign_jurisdiction,Foreign jurisdiction,Approved,"a jurisdiction outside of the United States, Canada or any province or political subdivision of the foregoing.",,,,,,,,,
Fraternal_Insurance,Fraternal Insurance,Approved,a form of group coverage or disability insurance available to members of a fraternal organization.,,,,,,,,,
