Name,Nick Name,Status,Definition,Acronym,Resources,Related Terms,Synonyms,Stewards,Experts,Parent Term Name,IsDefinitionRichText,Term Template Names
Fronting,Fronting,Approved,"an arrangement in which a primary insurer acts as the insurer of record by issuing a policy, but then passes the entire risk to a reinsurer in exchange for a commission. Often, the fronting insurer is licensed to do business in a state or country where the risk is located, but the reinsurer is not.",,,,,,,,,
Generally_Accepted_Accounting_Principles_GAAP,Generally Accepted Accounting Principles (GAAP),Approved,"an aggregate of the accounting standards, principles and best practices for the preparation of financial statements allowing for consistency in reporting.",,,,,,,,,
Goodwill,Goodwill,Approved,the difference between the cost of acquiring the entity and the reporting entity's share of the book value of the acquired entity.,,,,,,,,,
Gramm_Leach_Bliley_Act_GLBA,Gramm-Leach Bliley Act (GLBA),Approved,"act, repealing Glass-Steagal Act of 1933, allows consolidation of commercial banks, investment institutions and insurance companies. Established a framework of responsibilities of federal and state regulators for these financial industries. It permits financial services companies to merge and engage in a variety of new business activities, including insurance, while attempting to address the regulatory issues raised by such combinations.",,,,,,,,,
Gross_Paid_in_and_Contributed_Surplus,Gross Paid-in and Contributed Surplus ,Approved,amount of capital received in excess of the par value of the stock issued.,,,,,,,,,
Gross_Premium,Gross Premium,Approved,"the net premium for insurance plus commissions, operating and miscellaneous commissions. For life insurance, this is the premium including dividends.",,,,,,,,,
Group_Accident_and_Health,Group Accident and Health,Approved,"coverage written on a group basis (e.g., employees of a single employer and their dependents) that pays scheduled benefits or medical expenses caused by disease, accidental injury or accidental death. Excludes amounts attributable to uninsured accidents and health plans and the uninsured portion of partially insured accident and health plans.",,,,,,,,,
Group_Annuities_Deferred_Non_Variable_and_Variable,Group Annuities – Deferred Non- Variable and Variable,Approved,"an annuity contract that provides an accumulation based on both (1) funds that accumulate based on a guaranteed crediting interest rates or additional interest rate applied to designated considerations, and (2) funds where the accumulation vary in accordance with the rate of return of the underlying investment portfolio selected by the policyholder. The contract provides for the initiation of payments at some designated future date.",,,,,,,,,
Group_Annuities_Deferred_Variable,Group Annuities – Deferred Variable,Approved,an annuity contract that provides an accumulation based fund where the accumulation varies in accordance with the rate of return of the underlying investment portfolio selected by the policyholder. Must include at least one option to have the accumulation vary in accordance with the rate of return of the underlying investment portfolio selected by the policyholder and may include at least one option to have the series of payments vary in accordance with the rate of return of the underlying investment portfolio selected by the policyholder. This annuity contract provides for the initiation of payments at some designated future date.,,,,,,,,,
Group_Annuities_Immediate_Non_Variable_and_Variable,Group Annuities – Immediate Non-Variable and Variable,Approved,"an annuity contract that provides an accumulation based on both (1) funds that accumulate based on a guaranteed crediting interest rates or additional interest rate applied to designated considerations, and (2) funds where the accumulation vary in accordance with the rate of return of the underlying investment portfolio selected by the policyholder. The contract provides for the initiation of payments at some interval that may vary, however the annuity payouts must begin within 13 months.",,,,,,,,,
Group_Annuities_Immediate_Variable,Group Annuities – Immediate Variable,Approved,"an annuity contract that provides for the first payment of the annuity at the end of the fixed interval of payment after purchase. The interval may vary, however the annuity payouts must begin within 13 months. The amount varies with the value of equities (separate account) purchased as investments by the insurance companies.",,,,,,,,,
Group_Annuities_Unallocated,Group Annuities – Unallocated,Approved,annuity contracts or portions thereof where the Insurer purchases an annuity for the retirees.,,,,,,,,,
Group_Annuity,Group Annuity,Approved,"a contract providing income for a specified period of time, or duration of life for a person or persons established to benefit a group of employees.",,,,,,,,,
Group_Code,Group Code ,Approved,a unique three to five digit number assigned by the NAIC to identify those companies that are part of a larger group of insurance companies.,,,,,,,,,
Group_Credit_Life,Group Credit – Life,Approved,"contracts sold in connection with loan/credit transactions or other credit transactions, which do not exceed a stated duration and/or amount and provide insurance protection against death.",,,,,,,,,
Group_Health,Group Health ,Approved,"health insurance issued to employers, associations, trusts, or other groups covering employees or members and/or their dependents, to whom a certificate of coverage may be provided.",,,,,,,,,
Group_Health_Organizations_Health_Maintenance_HMO,Group Health Organizations – Health Maintenance (HMO),Approved,a plan under which an enrollee pays a membership fixed fee in advance in return for a wide range of comprehensive health care services with the HMO's approved providers in a designated service area.,,,,,,,,,
Guaranty_Fund,Guaranty Fund ,Approved,funding mechanism employed by states to provide funds to cover policyholder obligations of insolvent reporting entities.,,,,,,,,,
Hard_Market,Hard Market,Approved,a market characterized by high demand and low supply.,,,,,,,,,
Hazard,Hazard,Approved,circumstance which tends to increase the probability or severity of a loss.,,,,,,,,,
Health_Excess_Stop_Loss,Health – Excess/Stop Loss,Approved,this type of insurance may be extended to either a health plan or a self-insured employer plan. Its purpose is to insure against the risk that any one claim will exceed a specific dollar amount or that an entire plan's losses will exceed a specific amount.,,,,,,,,,
Health_Insurance,Health Insurance,Approved,a generic term applying to all types of insurance indemnifying or reimbursing for losses caused by bodily injury or illness including related medical expenses.,,,,,,,,,
Health_Maintenance_Organization_HMO,Health Maintenance Organization (HMO) ,Approved,"a medical group plan that provides physician, hospital, and clinical services to participating members in exchange for a periodic flat fee.",,,,,,,,,
Health_Plan,Health Plan ,Approved,"written promise of coverage given to an individual, family, or group of covered individuals, where a beneficiary is entitled to receive a defined set of health care benefits in exchange for a defined consideration, such as a premium.",,,,,,,,,
Hold_Harmless_Agreement,Hold-Harmless Agreement,Approved,A risk transfer mechanism whereby one party assumes the liability of another party by contract,,,,,,,,,
Homeowners_Insurance,Homeowners Insurance,Approved,"a package policy combining real and personal property coverage with personal liability coverage. Coverage applicable to the dwelling, appurtenant structures, unscheduled personal property and additional living expense are typical. Includes mobile homes at a fixed location.",,,,,,,,,
Hospital_Indemnity_Coverage,Hospital Indemnity Coverage ,Approved,"coverage that provides a pre-determined, fixed benefit or daily indemnity for contingencies based on a stay at a hospital or intensive care facility.",,,,,,,,,
Hull_Insurance,Hull Insurance,Approved,coverage for damage to a vessel or aircraft and affixed items.,,,,,,,,,
Incontestability_Provision,Incontestability Provision,Approved,a life insurance and annuity provision limiting the time within which the insurer has the legal right to void the contract on grounds of material misrepresentation in the policy application.,,,,,,,,,
Incurred_But_Not_Reported_IBNR,Incurred But Not Reported (IBNR) ,Approved,(Pure IBNR) claims that have occurred but the insurer has not been notified of them at the reporting date. Estimates are established to book these claims. May include losses that have been reported to the reporting entity but have not yet been entered into the claims system or bulk provisions. Bulk provisions are reserves included with other IBNR reserves to reflect deficiencies in known case reserves. IBNR can sometimes include estimates of incurred but Not Enough Reported (IBNER),,,,,,,,,
Incurred_Claims,Incurred Claims ,Approved,paid claims plus amounts held in reserve for those that have been incurred but not yet paid.,,,,,,,,,
Incurred_Losses,Incurred Losses,Approved,"sustained losses, paid or not, during a specified time period. Incurred losses are typically found by combining losses paid during the period plus unpaid losses sustained during the time period minus outstanding losses at the beginning of the period incurred in the previous period.",,,,,,,,,
"Indemnity,_Principle_of","Indemnity, Principle of",Approved,a general legal principle related to insurance that holds that the individual recovering under an insurance policy should be restored to the approximate financial position he or she was in prior to the loss. Legal principle limiting compensation for damages be equivalent to the losses incurred.,,,,,,,,,
Independent_Adjuster,Independent Adjuster,Approved,freelance contractor paid a fee for adjusting losses on behalf of companies.,,,,,,,,,
Independent_Agent,Independent Agent,Approved,a representative of multiple insurance companies who sells and services policies for records which they own and operate under the American Agency System.,,,,,,,,,
Independent_Contractor,Independent Contractor,Approved,an individual who is not employed for a company but instead works for themselves providing goods or services to clients for a fee.,,,,,,,,,
Index_Annuity,Index Annuity,Approved,"an interest bearing fixed annuity tied to an equity index, such as the Dow Jones Industrial Average or S & P 500.",,,,,,,,,
Individual_Annuities_Deferred_Variable,Individual Annuities – Deferred Variable,Approved,an annuity contract that provides an accumulation based fund where the accumulation varies in accordance with the rate of return of the underlying investment portfolio selected by the policyholder. Must include at least one option to have the accumulation vary in accordance with the rate of return of the underlying investment portfolio selected by the policyholder and may include at least one option to have the series of payments vary in accordance with the rate of return of the underlying investment portfolio selected by the policyholder. This annuity contract provides for the initiation of payments at some designated future date.,,,,,,,,,
Individual_Annuities_Immediate_Variable,Individual Annuities – Immediate Variable,Approved,"an annuity contract that provides for the first payment of the annuity at the end of the fixed interval of payment after purchase. The interval may vary, however the annuity payouts must begin within 13 months. The amount varies with the value of equities (separate account) purchased as investments by the insurance companies.",,,,,,,,,
Individual_Annuities_Special,Individual Annuities – Special,Approved,contracts with certain noteworthy attributes.,,,,,,,,,
Individual_Annuities_Deferred_Non_Variable_and_Variable,Individual Annuities- Deferred Non-Variable and Variable,Approved,"an annuity contract that provides an accumulation based on both (1) funds that accumulate based on a guaranteed crediting interest rates or additional interest rate applied to designated considerations, and (2) funds where the accumulation vary in accordance with the rate of return of the underlying investment portfolio selected by the policyholder. The contract provides for the initiation of payments at some designated future date.",,,,,,,,,
Individual_Annuities_Deferred_Non_Variable,Individual Annuities- Deferred Non-Variable,Approved,an annuity contract that provides an accumulation based on funds that accumulate based on a guaranteed crediting interest rate or additional interest rate. This annuity contract provides for the initiation of payments at some designated future date.,,,,,,,,,
Individual_Annuities_Immediate_Non_Variable_and_Variable,Individual Annuities- Immediate Non-Variable and Variable,Approved,"an annuity contract that provides an accumulation based on both (1) funds that accumulate based on a guaranteed crediting interest rates or additional interest rate applied to designated considerations, and (2) funds where the accumulation vary in accordance with the rate of return of the underlying investment portfolio selected by the policyholder. The contract provides for the initiation of payments at some interval that may vary, however the annuity payouts must begin within 13 months.",,,,,,,,,
Individual_Annuities_Immediate_Non_Variable,Individual Annuities- Immediate Non-Variable,Approved,"an annuity contract that provides for the fixed payment of the annuity at the end of the first interval of payment after purchase. The interval may vary, however the annuity payouts must begin within 13 months.",,,,,,,,,
Individual_Credit_Credit_Disability,Individual Credit – Credit Disability,Approved,makes monthly loan/credit transaction payments to the creditor upon the disablement of an insured debtor.,,,,,,,,,
Individual_Credit_Life,Individual Credit – Life,Approved,"contracts sold in connection with loan/credit transactions or other credit transactions, which do not exceed a stated duration and/or amount and provide insurance protection against death.",,,,,,,,,
Individual_Health,Individual Health,Approved,health insurance where the policy is issued to an individual covering the individual and/or their dependents in the individual market. This includes conversions from group policies.,,,,,,,,,
Industrial_Life,Industrial Life ,Approved,"Industrial life insurance, also called ""debit"" insurance, is insurance under which premiums are paid monthly or more often, the face amount of the policy does not exceed a stated amount, and the words ""industrial policy"" are printed in prominent type on the face of the policy.",,,,,,,,,
Inland_Marine,Inland Marine,Approved,"coverage for property that may be in transit, held by a bailee, at a fixed location, a movable good that is often at different locations (e.g., off road constructions equipment), or scheduled property (e.g., Homeowners Personal Property Floater) including items such as live animals, property with antique or collector's value, etc. This line also includes instrumentalities of transportation and communication, such as bridges, tunnels, piers, wharves, docks, pipelines, power and phone lines, and radio and television towers.",,,,,,,,,
Insurable_Interest,Insurable Interest,Approved,"A right or relationship in regard to the subject matter of the insured contract such that the insured can suffer a financial loss from damage, loss or destruction to it. (Bickelhaupt and Magee )",,,,,,,,,
Insurance_Holding_Company_System,Insurance Holding Company System ,Approved,"consists of two or more affiliated persons, one or more of which is an insurer.",,,,,,,,,
Insurance_Regulatory_Information_System_IRIS,Insurance Regulatory Information System (IRIS),Approved,a baseline solvency screening system for the National Association of Insurance Commissioners (NAIC) and state insurance regulators established in the mid-1970s.,,,,,,,,,
Insurance_to_Value,Insurance to Value,Approved,Amount of insurance purchased vs. the actual replacement cost of the insured property expressed as a ratio.,,,,,,,,,
Insurance,Insurance,Approved,an economic device transferring risk from an individual to a company and reducing the uncertainty of risk via pooling.,,,,,,,,,
Insured,Insured,Approved,party(ies) covered by an insurance policy.,,,,,,,,,
Insurer,Insurer,Approved,an insurer or reinsurer authorized to write property and/or casualty insurance under the laws of any state.,,,,,,,,,
Intermediary,Intermediary,Approved,"a person, corporation or other business entity (not licensed as a medical provider) that arranges, by contracts with physicians and other licensed medical providers, to deliver health services for a health insurer and its enrollees via a separate contract between the intermediary and the insurer.",,,,,,,,,
International,International,Approved,includes all business transacted outside the U.S. and its territories and possessions where the appropriate line of business is not determinable.,,,,,,,,,
Internet_Liability_Insurance_Cyber_Insurance,Internet Liability Insurance/Cyber Insurance,Approved,"coverage for cyber commerce including copyright infringement, libel, and violation of privacy.",,,,,,,,,
Investment_grade,Investment grade,Approved,"the obligation has been determined to be in one of the top four generic lettered rating classifications by a securities rating agency acceptable to the commissioner, that the obligation has been identified in writing by such a rating agency to be of investment grade quality, or, if the obligation has not been submitted to any such rating agency, that the obligation has been determined to be investment grade (Class 1 and Class 2) by the Securities Valuation Office of the National Association of Insurance Commissioners.",,,,,,,,,
Investment_Income_Accrued,Investment Income Accrued ,Approved,investment income earned as of the reporting date but not legally due to be paid to the reporting entity until subsequent to the reporting date.,,,,,,,,,
Investment_Income_Due,Investment Income Due ,Approved,investment income earned and legally due to be paid to the reporting entity as of the reporting date.,,,,,,,,,
Investment_Income_Gross,Investment Income Gross ,Approved,"shall be recorded as earned and shall include investment income collected during the period, the change in investment income due and accrued, the change in unearned investment income plus any amortization (e.g., discounts or premiums on bonds, origination fees on mortgage loans, etc.)",,,,,,,,,
Irrevocable_Beneficiary,Irrevocable Beneficiary,Approved,a life insurance policy beneficiary who has a vested interest in the policy proceeds even during the insured's lifetime because the policy owner has the right to change the beneficiary designation only after obtaining the beneficiary's consent.,,,,,,,,,
Joint_and_Last_Survivor_Annuity,Joint and Last Survivor Annuity,Approved,"retirement plan that continues to payout so long as at least one, of two or more, annuitants is alive.",,,,,,,,,
Joint_Underwriting_Association_JUA,Joint Underwriting Association (JUA),Approved,a loss-sharing mechanism combining several insurance companies to provide extra capacity due to type or size of exposure.,,,,,,,,,
Joint_Life_Annuity,Joint-Life Annuity,Approved,an annuity contract that ceases upon the death of the first of two or more annuitants.,,,,,,,,,
Key_Persons_Insurance,Key-Persons Insurance,Approved,"a policy purchased by, for the benefit of, a business insuring the life or lives of personnel integral to the business operations.",,,,,,,,,
Kidnap_Ransom_Insurance,Kidnap/Ransom Insurance,Approved,coverage for ransom or extortion costs and related expenses.,,,,,,,,,
Lapse,Lapse,Approved,termination of a policy due to failure to pay the required renewal premium.,,,,,,,,,
Level_Premium_Insurance,Level Premium Insurance,Approved,"life insurance policy for which the cost is equally distributed over the term of the premium period, remaining constant throughout.",,,,,,,,,
Liability,Liability,Approved,"a certain or probable future sacrifice of economic benefits arising from present obligations of a particular entity to transfer assets or to provide services to other entities in the future as a result of a past transactions(s) or event(s). three essential characteristics: a)&nbsp;&nbsp;&nbsp; It embodies a present duty or responsibility to one or more other entities that entails settlement by probable future transfer or use of assets at a specified or determinable date, on occurrence of a specified event, or on demand; b)&nbsp;&nbsp;&nbsp; The duty or responsibility obligates a particular entity, leaving it little or no discretion to avoid the future sacrifice; and c)&nbsp;&nbsp;&nbsp; The transaction or other event obligating the entity has already happened.",,,,,,,,,
Life_Endowment,Life – Endowment,Approved,"insurance that pays the same benefit amount should the insured die during the term of the contract, or if the insured survives to the end of the specified coverage term or age.",,,,,,,,,
Life_Flexible_Premium_Adjustable_Life,Life – Flexible Premium Adjustable Life,Approved,"a group life insurance that provides a face amount that is adjustable to the certificate holder and allows the certificate holder to vary the modal premium that is paid or to skip a payment so long as the certificate value is sufficient to keep the certificate in force, and under which separately identified interest credits (other than in connection with dividend accumulation, premium deposit funds or other supplementary accounts) and mortality and expense charges are made to individual certificates while providing minimum guaranteed values.",,,,,,,,,
Life_Settlements,Life Settlements,Approved,a contract or agreement in which a policyholder agrees to sell or transfer ownership in all or part of a life insurance policy to a third party for compensation that is less than the expected death benefit of a policy.,,,,,,,,,
Lifetime_Disability_Benefit,Lifetime Disability Benefit,Approved,a provision in some disability income policies to recoup lost wages for the term of disability or remainder of insured's life in case of permanent disability.,,,,,,,,,
Limited_Benefit,Limited Benefit,Approved,"policies that provide coverage for vision, prescription drug, and/or any other single service plan or program. Also include short-term care policies that provide coverage for less than one year for medical and other services provided in a setting other than an acute care unit of the hospital.",,,,,,,,,
Limited_Payment_Life_Insurance,Limited Payment Life Insurance,Approved,a form of whole-life insurance with a pre-defined number of premiums to be paid.,,,,,,,,,
Limited_Policies,Limited Policies,Approved,"health insurance coverage for a certain ailment, such as cancer.",,,,,,,,,
Limits,Limits,Approved,maximum value to be derived from a policy.,,,,,,,,,
Line_of_Business,Line of Business ,Approved,classification of business written by insurers.,,,,,,,,,
Liquor_Liability,Liquor Liability,Approved,"coverage for the liability of an entity involved in the retail or wholesale sales of alcoholic beverages, or the serving of alcoholic beverages, to persons who have incurred bodily injury or property damage arising from an intoxicated person.",,,,,,,,,
Living_benefits_rider,Living benefits rider,Approved,a rider attached to a life insurance policy providing long term care for the terminally ill.,,,,,,,,,
Lloyds_of_London,Lloyd's of London,Approved,association offering membership in various syndicates of wealthy individuals organized for the purpose of writing insurance for a particular hazard.,,,,,,,,,
Loan_backed_Securities,Loan-backed Securities ,Approved,"pass-through certificates, collateralized mortgage obligations (CMOs), and other securitized loans not included in structured securities where payment of interest and/or principal is directly proportional to the interest and/or principal received by the issuer from the mortgage pool or other underlying securities.",,,,,,,,,
Long_Duration_Contracts,Long Duration Contracts,Approved,"contracts, excluding financial guaranty contracts, mortgage guaranty contracts and surety contracts, that fulfill both of the following conditions: (1) the contract term is greater than or equal to thirteen months and (2) the insurer can neither cancel nor increase the premium during the contract term.",,,,,,,,,
Long_Term_Care,Long-Term Care,Approved,"policies that provide coverage for not less than one year for diagnostic, preventive, therapeutic, rehabilitative, maintenance, or personal care services provided in a setting other than an acute care unit of a hospital, including policies that provide benefits for cognitive impairment or loss of functional capacity. This includes policies providing only nursing home care, home health care, community based care, or any combination. The policy does not include coverage provided under comprehensive/major medical policies, Medicare Advantage, or for accelerated heath benefit-type products.",,,,,,,,,
Long_Term_Disability_Income_Insurance,Long-Term Disability Income Insurance,Approved,"policy providing monthly income payments for insureds who become disabled for an extensive length of time, typically two years or longer.",,,,,,,,,
Loss_Adjustment_Expense_LAE,Loss Adjustment Expense (LAE) ,Approved,expected payments for costs to be incurred in connection with the adjustment and recording of losses. Can be classified into two broad categories: Defense and Cost Containment (DCC) and Adjusting and Other (AO). Can also be separated into (Allocated Loss Adjustment Expense) and (Unallocated Loss Adjustment Expense for ratemaking purposes.,,,,,,,,,
